{
  "session_id": "5b8fcfb7-6492-4794-8911-62e5d09f468e",
  "created_at": "2025-08-22T00:58:53.610773",
  "last_active": "2025-08-22T00:59:04.902307",
  "conversation_history": [
    {
      "user_query": "Compare Slack vs Discord in terms of features and limitations",
      "assistant_response": "Okay, let's break down the comparison between Slack and Discord based on the provided data, focusing on actionable insights.\n\n**1. Direct Comparison:**\n\n| Feature          | Slack                                  | Discord                                   |\n|-------------------|----------------------------------------|-----------------------------------------|\n| **Best For**     | Professional team messaging            | Always-on voice chat & gaming communities |\n| **Key Features** | Channels, DMs, 90-day history, 5GB storage | Voice channels, screen sharing, unlimited use |\n| **User Limit**   | Unlimited users                        | Unlimited users                         |\n| **Limitations**  | 90-day message history, 10 app integrations | Gaming-focused interface, limited business features |\n| **Cost**         | Free                                   | Free                                    |\n\n**2. Key Differences in Features and Capabilities:**\n\n*   **Focus:** Slack is designed for professional communication and collaboration, while Discord is built for community building and real-time voice interaction, particularly within gaming.\n*   **Communication Style:** Slack emphasizes organized, text-based channels and direct messages. Discord prioritizes voice channels and instant communication.\n*   **History & Storage:** Slack's free tier limits message history to 90 days and storage to 5GB. Discord offers unlimited use, implying more generous (though perhaps not explicitly defined) history and storage.\n*   **Integrations:** Slack limits free users to 10 app integrations, which can impact workflow automation. Discord's integration capabilities are less explicitly defined in this data but are generally focused on gaming and community-related bots.\n\n**3. Strengths and Weaknesses:**\n\n*   **Slack:**\n    *   **Strengths:** Organized communication, strong search capabilities (within the 90-day limit), professional environment, integrations with business tools.\n    *   **Weaknesses:** Limited message history in the free tier, limited integrations, can become expensive as teams grow and require more features.\n*   **Discord:**\n    *   **Strengths:** Excellent voice communication, screen sharing, strong community features, always-on availability, free.\n    *   **Weaknesses:** Interface and features are geared towards gaming, less suitable for formal business communication, limited business-focused integrations.\n\n**4. Use Cases:**\n\n*   **Slack is better for:**\n    *   Businesses and professional teams needing organized communication and collaboration.\n    *   Projects requiring integration with tools like Google Drive, Asana, or project management software.\n    *   Teams that prioritize searchable message history (within the paid tier).\n*   **Discord is better for:**\n    *   Online communities, especially gaming communities, that need real-time voice and text chat.\n    *   Groups that prioritize instant communication and screen sharing.\n    *   Organizations with limited budgets that need a free communication platform.\n\n**5. Recommendations Based on Scenarios:**\n\n*   **Small Business/Startup (Budget-Conscious):**\n    *   *Consider Discord initially.* If the team is comfortable with the interface and the lack of business-specific integrations isn't a major issue, Discord can be a cost-effective solution.  However, be mindful of the potential for a less professional communication style.\n*   **Small Business/Startup (Growth-Focused):**\n    *   *Start with Slack's free tier, but plan to upgrade.* The organized channels and integrations will be valuable as the company grows.  Factor in the cost of upgrading to a paid plan to retain message history and increase integration limits.\n*   **Large Enterprise:**\n    *   *Slack is likely the better choice.* The enterprise-level features, security, and integrations are essential for managing a large organization.\n*   **Gaming Community:**\n    *   *Discord is the clear winner.* It's built for this purpose.\n*   **Hybrid Scenario (e.g., a company with a gaming division):**\n    *   *Use both.* Slack for internal business communication and Discord for community engagement or specific team activities where voice chat and screen sharing are paramount.\n\n**Key Takeaway:** The best choice depends heavily on the specific needs and priorities of the organization or group. Consider the importance of organized communication, integrations, budget, and the need for real-time voice interaction when making your decision.\n",
      "timestamp": "2025-08-22T00:59:04.902307",
      "agent_responses": [
        {
          "agent": "data_analysis",
          "operation": "analyze",
          "response": "Okay, let's break down the comparison between Slack and Discord based on the provided data, focusing on actionable insights.\n\n**1. Direct Comparison:**\n\n| Feature          | Slack                                  | Discord                                   |\n|-------------------|----------------------------------------|-----------------------------------------|\n| **Best For**     | Professional team messaging            | Always-on voice chat & gaming communities |\n| **Key Features** | Channels, DMs, 90-day history, 5GB storage | Voice channels, screen sharing, unlimited use |\n| **User Limit**   | Unlimited users                        | Unlimited users                         |\n| **Limitations**  | 90-day message history, 10 app integrations | Gaming-focused interface, limited business features |\n| **Cost**         | Free                                   | Free                                    |\n\n**2. Key Differences in Features and Capabilities:**\n\n*   **Focus:** Slack is designed for professional communication and collaboration, while Discord is built for community building and real-time voice interaction, particularly within gaming.\n*   **Communication Style:** Slack emphasizes organized, text-based channels and direct messages. Discord prioritizes voice channels and instant communication.\n*   **History & Storage:** Slack's free tier limits message history to 90 days and storage to 5GB. Discord offers unlimited use, implying more generous (though perhaps not explicitly defined) history and storage.\n*   **Integrations:** Slack limits free users to 10 app integrations, which can impact workflow automation. Discord's integration capabilities are less explicitly defined in this data but are generally focused on gaming and community-related bots.\n\n**3. Strengths and Weaknesses:**\n\n*   **Slack:**\n    *   **Strengths:** Organized communication, strong search capabilities (within the 90-day limit), professional environment, integrations with business tools.\n    *   **Weaknesses:** Limited message history in the free tier, limited integrations, can become expensive as teams grow and require more features.\n*   **Discord:**\n    *   **Strengths:** Excellent voice communication, screen sharing, strong community features, always-on availability, free.\n    *   **Weaknesses:** Interface and features are geared towards gaming, less suitable for formal business communication, limited business-focused integrations.\n\n**4. Use Cases:**\n\n*   **Slack is better for:**\n    *   Businesses and professional teams needing organized communication and collaboration.\n    *   Projects requiring integration with tools like Google Drive, Asana, or project management software.\n    *   Teams that prioritize searchable message history (within the paid tier).\n*   **Discord is better for:**\n    *   Online communities, especially gaming communities, that need real-time voice and text chat.\n    *   Groups that prioritize instant communication and screen sharing.\n    *   Organizations with limited budgets that need a free communication platform.\n\n**5. Recommendations Based on Scenarios:**\n\n*   **Small Business/Startup (Budget-Conscious):**\n    *   *Consider Discord initially.* If the team is comfortable with the interface and the lack of business-specific integrations isn't a major issue, Discord can be a cost-effective solution.  However, be mindful of the potential for a less professional communication style.\n*   **Small Business/Startup (Growth-Focused):**\n    *   *Start with Slack's free tier, but plan to upgrade.* The organized channels and integrations will be valuable as the company grows.  Factor in the cost of upgrading to a paid plan to retain message history and increase integration limits.\n*   **Large Enterprise:**\n    *   *Slack is likely the better choice.* The enterprise-level features, security, and integrations are essential for managing a large organization.\n*   **Gaming Community:**\n    *   *Discord is the clear winner.* It's built for this purpose.\n*   **Hybrid Scenario (e.g., a company with a gaming division):**\n    *   *Use both.* Slack for internal business communication and Discord for community engagement or specific team activities where voice chat and screen sharing are paramount.\n\n**Key Takeaway:** The best choice depends heavily on the specific needs and priorities of the organization or group. Consider the importance of organized communication, integrations, budget, and the need for real-time voice interaction when making your decision.\n",
          "response_type": "analysis",
          "metadata": {
            "analysis_type": "comparative",
            "items_compared": [
              "Slack",
              "Discord"
            ],
            "comparison_type": "qualitative"
          },
          "artifacts": {
            "comparison_data": [
              {
                "Platform": "Slack",
                "Best_For": "Professional team messaging",
                "Key_Features": "Channels, DMs, 90-day history, 5GB storage",
                "User_Limit": "Unlimited users",
                "Main_Limitations": "90-day message history, 10 app integrations",
                "Cost": "Free"
              },
              {
                "Platform": "Discord",
                "Best_For": "Always-on voice chat and gaming communities",
                "Key_Features": "Voice channels, screen sharing, unlimited use",
                "User_Limit": "Unlimited users",
                "Main_Limitations": "Gaming-focused interface, limited business features",
                "Cost": "Free"
              }
            ]
          }
        }
      ],
      "metadata": {
        "orchestrator_workflow": true,
        "success": true
      }
    }
  ],
  "dataset_info": {
    "name": "temp_5b8fcfb7-6492-4794-8911-62e5d09f468e_sample_data",
    "file_path": "temp\\temp_5b8fcfb7-6492-4794-8911-62e5d09f468e_sample_data.csv",
    "shape": [
      16,
      6
    ],
    "columns": [
      "Platform",
      "Best_For",
      "Key_Features",
      "User_Limit",
      "Main_Limitations",
      "Cost"
    ],
    "dtypes": {
      "Platform": "object",
      "Best_For": "object",
      "Key_Features": "object",
      "User_Limit": "object",
      "Main_Limitations": "object",
      "Cost": "object"
    },
    "summary_stats": {
      "missing_values": {
        "Platform": 0,
        "Best_For": 0,
        "Key_Features": 0,
        "User_Limit": 0,
        "Main_Limitations": 0,
        "Cost": 0
      },
      "unique_values": {
        "Platform": 16,
        "Best_For": 16,
        "Key_Features": 16,
        "User_Limit": 5,
        "Main_Limitations": 16,
        "Cost": 1
      }
    },
    "quality_info": {
      "total_rows": 16,
      "total_columns": 6,
      "memory_usage": 7924,
      "issues": [
        {
          "type": "constant_columns",
          "columns": [
            "Cost"
          ],
          "description": "Columns with constant or single unique value"
        }
      ],
      "potential_id_columns": [
        "Platform",
        "Best_For",
        "Key_Features",
        "Main_Limitations"
      ]
    },
    "last_analyzed": null
  },
  "cached_results": {
    "result_20250822_005904": {
      "query": "Compare Slack vs Discord in terms of features and limitations",
      "response": "Okay, let's break down the comparison between Slack and Discord based on the provided data, focusing on actionable insights.\n\n**1. Direct Comparison:**\n\n| Feature          | Slack                                  | Discord                                   |\n|-------------------|----------------------------------------|-----------------------------------------|\n| **Best For**     | Professional team messaging            | Always-on voice chat & gaming communities |\n| **Key Features** | Channels, DMs, 90-day history, 5GB storage | Voice channels, screen sharing, unlimited use |\n| **User Limit**   | Unlimited users                        | Unlimited users                         |\n| **Limitations**  | 90-day message history, 10 app integrations | Gaming-focused interface, limited business features |\n| **Cost**         | Free                                   | Free                                    |\n\n**2. Key Differences in Features and Capabilities:**\n\n*   **Focus:** Slack is designed for professional communication and collaboration, while Discord is built for community building and real-time voice interaction, particularly within gaming.\n*   **Communication Style:** Slack emphasizes organized, text-based channels and direct messages. Discord prioritizes voice channels and instant communication.\n*   **History & Storage:** Slack's free tier limits message history to 90 days and storage to 5GB. Discord offers unlimited use, implying more generous (though perhaps not explicitly defined) history and storage.\n*   **Integrations:** Slack limits free users to 10 app integrations, which can impact workflow automation. Discord's integration capabilities are less explicitly defined in this data but are generally focused on gaming and community-related bots.\n\n**3. Strengths and Weaknesses:**\n\n*   **Slack:**\n    *   **Strengths:** Organized communication, strong search capabilities (within the 90-day limit), professional environment, integrations with business tools.\n    *   **Weaknesses:** Limited message history in the free tier, limited integrations, can become expensive as teams grow and require more features.\n*   **Discord:**\n    *   **Strengths:** Excellent voice communication, screen sharing, strong community features, always-on availability, free.\n    *   **Weaknesses:** Interface and features are geared towards gaming, less suitable for formal business communication, limited business-focused integrations.\n\n**4. Use Cases:**\n\n*   **Slack is better for:**\n    *   Businesses and professional teams needing organized communication and collaboration.\n    *   Projects requiring integration with tools like Google Drive, Asana, or project management software.\n    *   Teams that prioritize searchable message history (within the paid tier).\n*   **Discord is better for:**\n    *   Online communities, especially gaming communities, that need real-time voice and text chat.\n    *   Groups that prioritize instant communication and screen sharing.\n    *   Organizations with limited budgets that need a free communication platform.\n\n**5. Recommendations Based on Scenarios:**\n\n*   **Small Business/Startup (Budget-Conscious):**\n    *   *Consider Discord initially.* If the team is comfortable with the interface and the lack of business-specific integrations isn't a major issue, Discord can be a cost-effective solution.  However, be mindful of the potential for a less professional communication style.\n*   **Small Business/Startup (Growth-Focused):**\n    *   *Start with Slack's free tier, but plan to upgrade.* The organized channels and integrations will be valuable as the company grows.  Factor in the cost of upgrading to a paid plan to retain message history and increase integration limits.\n*   **Large Enterprise:**\n    *   *Slack is likely the better choice.* The enterprise-level features, security, and integrations are essential for managing a large organization.\n*   **Gaming Community:**\n    *   *Discord is the clear winner.* It's built for this purpose.\n*   **Hybrid Scenario (e.g., a company with a gaming division):**\n    *   *Use both.* Slack for internal business communication and Discord for community engagement or specific team activities where voice chat and screen sharing are paramount.\n\n**Key Takeaway:** The best choice depends heavily on the specific needs and priorities of the organization or group. Consider the importance of organized communication, integrations, budget, and the need for real-time voice interaction when making your decision.\n",
      "artifacts": {
        "comparison_data": [
          {
            "Platform": "Slack",
            "Best_For": "Professional team messaging",
            "Key_Features": "Channels, DMs, 90-day history, 5GB storage",
            "User_Limit": "Unlimited users",
            "Main_Limitations": "90-day message history, 10 app integrations",
            "Cost": "Free"
          },
          {
            "Platform": "Discord",
            "Best_For": "Always-on voice chat and gaming communities",
            "Key_Features": "Voice channels, screen sharing, unlimited use",
            "User_Limit": "Unlimited users",
            "Main_Limitations": "Gaming-focused interface, limited business features",
            "Cost": "Free"
          }
        ]
      },
      "timestamp": "2025-08-22T00:59:04.902307"
    }
  },
  "user_preferences": {},
  "metadata": {},
  "temp_files": [
    "temp\\temp_5b8fcfb7-6492-4794-8911-62e5d09f468e_sample_data.csv"
  ]
}